{
  "schema_version": 1,
  "model": {
    "repo_id": "deepseek-ai/DeepSeek-V4-Flash-0731",
    "revision": "7872f01b1d1fe23eabc4c98b48bffcef5a386062",
    "library_name": "transformers",
    "model_type": "deepseek_v4",
    "architecture": "DeepseekV4ForCausalLM",
    "config_path": "config.json"
  },
  "provenance": {
    "model_api": "https://huggingface.co/api/models/deepseek-ai/DeepSeek-V4-Flash-0731/revision/7872f01b1d1fe23eabc4c98b48bffcef5a386062",
    "tree_api": "https://huggingface.co/api/models/deepseek-ai/DeepSeek-V4-Flash-0731/tree/7872f01b1d1fe23eabc4c98b48bffcef5a386062?recursive=true&limit=1000",
    "metadata_observed_on": "2026-09-02"
  },
  "license": {
    "spdx": "MIT",
    "file_path": "LICENSE"
  },
  "generation_config": {
    "path": "generation_config.json",
    "do_sample": true,
    "temperature": 1.0,
    "top_p": 1.0
  },
  "chat_template": {
    "policy": "absent",
    "jinja": false
  },
  "tokenizer": {
    "tokenizer_path": "tokenizer.json",
    "config_path": "tokenizer_config.json",
    "tokenizer_class": "PreTrainedTokenizerFast"
  },
  "weights": {
    "format": "safetensors",
    "index_path": "model.safetensors.index.json",
    "shard_count": 48,
    "shards": [
      "model-00001-of-00048.safetensors",
      "model-00002-of-00048.safetensors",
      "model-00003-of-00048.safetensors",
      "model-00004-of-00048.safetensors",
      "model-00005-of-00048.safetensors",
      "model-00006-of-00048.safetensors",
      "model-00007-of-00048.safetensors",
      "model-00008-of-00048.safetensors",
      "model-00009-of-00048.safetensors",
      "model-00010-of-00048.safetensors",
      "model-00011-of-00048.safetensors",
      "model-00012-of-00048.safetensors",
      "model-00013-of-00048.safetensors",
      "model-00014-of-00048.safetensors",
      "model-00015-of-00048.safetensors",
      "model-00016-of-00048.safetensors",
      "model-00017-of-00048.safetensors",
      "model-00018-of-00048.safetensors",
      "model-00019-of-00048.safetensors",
      "model-00020-of-00048.safetensors",
      "model-00021-of-00048.safetensors",
      "model-00022-of-00048.safetensors",
      "model-00023-of-00048.safetensors",
      "model-00024-of-00048.safetensors",
      "model-00025-of-00048.safetensors",
      "model-00026-of-00048.safetensors",
      "model-00027-of-00048.safetensors",
      "model-00028-of-00048.safetensors",
      "model-00029-of-00048.safetensors",
      "model-00030-of-00048.safetensors",
      "model-00031-of-00048.safetensors",
      "model-00032-of-00048.safetensors",
      "model-00033-of-00048.safetensors",
      "model-00034-of-00048.safetensors",
      "model-00035-of-00048.safetensors",
      "model-00036-of-00048.safetensors",
      "model-00037-of-00048.safetensors",
      "model-00038-of-00048.safetensors",
      "model-00039-of-00048.safetensors",
      "model-00040-of-00048.safetensors",
      "model-00041-of-00048.safetensors",
      "model-00042-of-00048.safetensors",
      "model-00043-of-00048.safetensors",
      "model-00044-of-00048.safetensors",
      "model-00045-of-00048.safetensors",
      "model-00046-of-00048.safetensors",
      "model-00047-of-00048.safetensors",
      "model-00048-of-00048.safetensors"
    ]
  },
  "install": {
    "manifest_marker": ".model-lock.sha256",
    "unexpected_files": "reject"
  },
  "totals": {
    "file_count": 54,
    "selected_size_bytes": 166898509296,
    "weight_size_bytes": 166886535336
  },
  "files": [
    {"path": "LICENSE", "size": 1084, "role": "license", "git_blob_sha1": "d62e3bef9f054f21b7fc616365850fbf879a99ff"},
    {"path": "config.json", "size": 1888, "role": "config", "git_blob_sha1": "5f2da9100036b39e26ebe5ab493c5e8d4004d8a1"},
    {"path": "generation_config.json", "size": 170, "role": "generation_config", "git_blob_sha1": "c56a8c5bf06ff7740b6a33ee67b38b6237a230b1"},
    {"path": "model-00001-of-00048.safetensors", "size": 1059061856, "role": "weight", "sha256": "f3668ba4cccf1ca6a7eb84e888fb92c1cdc7204d472ba9db771e6fd3abf6b874"},
    {"path": "model-00002-of-00048.safetensors", "size": 3566321192, "role": "weight", "sha256": "77b26c939a0e25b3113c8d6bb04e1901a748bd4a7d2589e3bfdaabdf1e9bba14"},
    {"path": "model-00003-of-00048.safetensors", "size": 3566321192, "role": "weight", "sha256": "412abf4c906faadc221ef0cb50f90fe20bde8454a08ad4dc2364b6b79e7fda5c"},
    {"path": "model-00004-of-00048.safetensors", "size": 3596229272, "role": "weight", "sha256": "9610f56bc587fb0ff9a8b68a60299482ee8c433fe5b5587e4257aca98add4a2e"},
    {"path": "model-00005-of-00048.safetensors", "size": 3568768976, "role": "weight", "sha256": "f87a5ac7b8becc31f9c3169afd3a6f33fb82b4af9e21022e3755a10bc28f0180"},
    {"path": "model-00006-of-00048.safetensors", "size": 3590024776, "role": "weight", "sha256": "4a4f3764e3fc772b9fba67f0a44ef68e18f178b6f00faa80b75db549e51894cd"},
    {"path": "model-00007-of-00048.safetensors", "size": 3568768976, "role": "weight", "sha256": "df81bb80e27a689e01fa579eebd6499f86e0b6105f7fea18961aa5eebbbee9bc"},
    {"path": "model-00008-of-00048.safetensors", "size": 3590024776, "role": "weight", "sha256": "224968d2b27f8669365ec08657a768dfec40da0585f85f302a31495931f6a526"},
    {"path": "model-00009-of-00048.safetensors", "size": 3568768976, "role": "weight", "sha256": "04d69ef1071fff8721c62968c200a5583122b59b015e9ef9b2978bfed271b2b7"},
    {"path": "model-00010-of-00048.safetensors", "size": 3590024776, "role": "weight", "sha256": "627145f4ebeb1cc3f5bdd03416b8cb7370b3c96974853cbeb8e5516ad5713e49"},
    {"path": "model-00011-of-00048.safetensors", "size": 3568768976, "role": "weight", "sha256": "e4b8e601dcbebe902e0102e7b098b670a121cb8b9564dd719fc41d782c8416e0"},
    {"path": "model-00012-of-00048.safetensors", "size": 3590026352, "role": "weight", "sha256": "64ed4e5f6126ba029c462c9d5fca0fc907c5f855b4ba01194d79560f6db16e42"},
    {"path": "model-00013-of-00048.safetensors", "size": 3568770544, "role": "weight", "sha256": "8dfe199d07c07ddd141c2c0136a2237f1161250a1a03ebe8deaabac93440da1d"},
    {"path": "model-00014-of-00048.safetensors", "size": 3590026352, "role": "weight", "sha256": "45db2f540f825f92453c50335e49aede58cca56bc578d1787c12a0fbca6593e5"},
    {"path": "model-00015-of-00048.safetensors", "size": 3568770544, "role": "weight", "sha256": "5810381a0f05b7381c002d299ed6ac19e42eba8070dd17e2703546944d84f292"},
    {"path": "model-00016-of-00048.safetensors", "size": 3590026352, "role": "weight", "sha256": "e0530b7024771b0ce2df9b40bcc2232578f3300178487ec216863b0b2835617b"},
    {"path": "model-00017-of-00048.safetensors", "size": 3568770544, "role": "weight", "sha256": "ed11130247118b185ade893c0109bad896dd394cb1e066ce4fce044176261d94"},
    {"path": "model-00018-of-00048.safetensors", "size": 3590026352, "role": "weight", "sha256": "e393fea96da2a3414ef089354fc32e1c8891954de40958c84d2c2ecf80365b25"},
    {"path": "model-00019-of-00048.safetensors", "size": 3568770544, "role": "weight", "sha256": "a74ca4d3e8e82ce20c458bb8b1900110b753793ad4c58d08f38995f719c616f7"},
    {"path": "model-00020-of-00048.safetensors", "size": 3590026352, "role": "weight", "sha256": "9f556769926e60309e8defe45ab59fc8b26ae460d30c190cd746a3d78c11e2c2"},
    {"path": "model-00021-of-00048.safetensors", "size": 3568770544, "role": "weight", "sha256": "1671cce7f90d781f796b5ca6bf32dd1aeb740abcb2735e41ffd28f62485ce005"},
    {"path": "model-00022-of-00048.safetensors", "size": 3590026352, "role": "weight", "sha256": "decd67a4bd97a75fa36861d2ad3067afeefa6a04a20da997fe6c19f171e70132"},
    {"path": "model-00023-of-00048.safetensors", "size": 3568770544, "role": "weight", "sha256": "c61a3e179cdbee19bfb8cbc4e111928ce2f1e1f0f4729d7c0cd5634354a4689d"},
    {"path": "model-00024-of-00048.safetensors", "size": 3590026352, "role": "weight", "sha256": "fc27aeb4233534f6f7781dcfe57127a3908ae10fc025c5d86dc0682057f8b2fe"},
    {"path": "model-00025-of-00048.safetensors", "size": 3568770544, "role": "weight", "sha256": "a66b6b8d5821b68f5b511e4f91e12025cd07d0fa6d0b71e722d825a2d6d878ca"},
    {"path": "model-00026-of-00048.safetensors", "size": 3590026352, "role": "weight", "sha256": "657b89314fbaf6eee4acce24b3baf7e5fd2c5986a96ad85b08d90539cde869fe"},
    {"path": "model-00027-of-00048.safetensors", "size": 3568770544, "role": "weight", "sha256": "fb01f21a0da0446b0bdf25a127ab19a6b06006acd8735f06a9ebfe34423fd7f5"},
    {"path": "model-00028-of-00048.safetensors", "size": 3590026352, "role": "weight", "sha256": "b2fd5cbbb639f16e673bc484e5cca16b52a58bf2ab4bd62592e0c5408712ad7c"},
    {"path": "model-00029-of-00048.safetensors", "size": 3568770544, "role": "weight", "sha256": "9ec2fdf900275daeac0980490c5c731cc7868b151ce1de5698f48418de4fa5f0"},
    {"path": "model-00030-of-00048.safetensors", "size": 3590026352, "role": "weight", "sha256": "9ed3c317bf967d32133ad3a068ee4c56aae9784bc8b7da694482437f37dc1782"},
    {"path": "model-00031-of-00048.safetensors", "size": 3568770544, "role": "weight", "sha256": "d5078c3fca3e6370043606ead7856e0b8fe67a9aab52c415769f29934c4d7f5d"},
    {"path": "model-00032-of-00048.safetensors", "size": 3590026352, "role": "weight", "sha256": "163653848f002718d3deaa6ce48885483fc1f2e12e50e44a47477c73ccd91393"},
    {"path": "model-00033-of-00048.safetensors", "size": 3568770544, "role": "weight", "sha256": "f2cffd43f2a5f491f4691f8694e6bc08239158e143ae7063dc04f0eb0259214a"},
    {"path": "model-00034-of-00048.safetensors", "size": 3590026352, "role": "weight", "sha256": "0f94945121474cfdb6a9ab175914d3811ffbf08e6cc54082e14e473c755d18d8"},
    {"path": "model-00035-of-00048.safetensors", "size": 3568770544, "role": "weight", "sha256": "9cb6a316989f7c7385e3ec2bd42ffe766ee126c70ef3466742849982ee1b0f0f"},
    {"path": "model-00036-of-00048.safetensors", "size": 3590026352, "role": "weight", "sha256": "7e6761421fe944c2143eb897b983085891b421c148c6c17fb5cd8eaa9bdaa497"},